{
  "schema": "fdf/effective-instructions-compact.v1",
  "fdf_version": "1.2.1",
  "created_at": "2026-03-04T00:00:00Z",
  "effective_matrix": {
    "schema": "fdf/effective-rule-matrix.v1",
    "fdf_version": "1.2.1",
    "created_at": "2026-03-04T00:00:00Z",
    "selected_profiles": [],
    "profile_overrides": {},
    "enabled_packs": [],
    "rule_matrix": {
      "scope": [],
      "explore": [],
      "clarify": [],
      "architect": [],
      "implement": [],
      "verify": [],
      "summarize": []
    }
  },
  "phase_instructions": {
    "scope": "",
    "explore": "",
    "clarify": "",
    "architect": "",
    "implement": "",
    "verify": "",
    "summarize": ""
  },
  "provenance_files": [
    {
      "kind": "rule",
      "id": "scope-baseline",
      "path": "skills/feature-driven-flow/extensions/rules/scope-baseline.md"
    }
  ],
  "custom_instructions": {
    "decision": "none",
    "summary": "",
    "items": []
  },
  "notes": ""
}
